{
  "schema": "fastdb.payload.v1",
  "profile": "object_graph.v1",
  "entries": [
    {"id": "root", "cardinality": "one", "type": {"kind": "component", "id": "Node"}},
    {"id": "asset", "cardinality": "one", "type": {"kind": "component", "id": "Asset"}},
    {"id": "refs", "cardinality": "many", "type": {"kind": "ref", "target": "Node", "nullable": true}},
    {"id": "u8n_values", "cardinality": "many", "type": {"kind": "u8n", "min": 0, "max": 1}},
    {"id": "u16n_values", "cardinality": "many", "type": {"kind": "u16n", "min": -1, "max": 1}}
  ],
  "components": [
    {
      "id": "Node",
      "kind": "record",
      "fields": [
        {"id": "a_bool", "type": {"kind": "bool"}},
        {"id": "b_u8", "type": {"kind": "u8"}},
        {"id": "c_u16", "type": {"kind": "u16"}},
        {"id": "d_u32", "type": {"kind": "u32"}},
        {"id": "e_i32", "type": {"kind": "i32"}},
        {"id": "f_u8n", "type": {"kind": "u8n", "min": 0, "max": 1}},
        {"id": "g_u16n", "type": {"kind": "u16n", "min": -1, "max": 1}},
        {"id": "h_f32", "type": {"kind": "f32"}},
        {"id": "i_f64", "type": {"kind": "f64"}},
        {"id": "j_str", "type": {"kind": "str"}},
        {"id": "k_wstr", "type": {"kind": "wstr"}},
        {"id": "l_bytes", "type": {"kind": "bytes"}},
        {"id": "m_inline", "type": {"kind": "component", "id": "Inline"}},
        {"id": "n_values", "type": {"kind": "list", "items": {"kind": "f32", "nullable": true}}},
        {"id": "o_peer", "type": {"kind": "ref", "target": "Node"}},
        {"id": "p_asset", "type": {"kind": "ref", "target": "Asset"}}
      ]
    },
    {
      "id": "Inline",
      "kind": "record",
      "fields": [
        {"id": "flag", "type": {"kind": "bool", "nullable": true}},
        {"id": "code", "type": {"kind": "u16"}}
      ]
    },
    {
      "id": "Asset",
      "kind": "record",
      "fields": [
        {"id": "name", "type": {"kind": "str"}},
        {"id": "owner", "type": {"kind": "ref", "target": "Node", "nullable": true}}
      ]
    }
  ]
}
