{
  "schema": "fastdb.payload.v1",
  "profile": "object_graph.v1",
  "entries": [
    {"id": "root", "cardinality": "one", "type": {"kind": "component", "id": "Node"}},
    {
      "id": "matrices",
      "cardinality": "many",
      "type": {
        "kind": "list",
        "nullable": true,
        "items": {
          "kind": "list",
          "nullable": true,
          "items": {"kind": "u16", "nullable": true}
        }
      }
    }
  ],
  "components": [
    {
      "id": "Node",
      "kind": "record",
      "fields": [
        {
          "id": "matrix",
          "type": {
            "kind": "list",
            "items": {
              "kind": "list",
              "nullable": true,
              "items": {"kind": "u16", "nullable": true}
            }
          }
        },
        {"id": "box", "type": {"kind": "component", "id": "Box"}}
      ]
    },
    {
      "id": "Box",
      "kind": "record",
      "fields": [
        {
          "id": "values",
          "type": {
            "kind": "list",
            "nullable": true,
            "items": {
              "kind": "list",
              "items": {"kind": "u8", "nullable": true}
            }
          }
        }
      ]
    }
  ]
}
