{
  "schema": "fastdb.payload.v1",
  "profile": "record.v1",
  "entries": [
    {"id": "a_bool", "cardinality": "many", "type": {"kind": "bool"}},
    {"id": "b_u8", "cardinality": "many", "type": {"kind": "u8"}},
    {"id": "c_u16", "cardinality": "many", "type": {"kind": "u16"}},
    {"id": "d_u32", "cardinality": "many", "type": {"kind": "u32"}},
    {"id": "e_i32", "cardinality": "many", "type": {"kind": "i32"}},
    {"id": "f_f32", "cardinality": "many", "type": {"kind": "f32"}},
    {"id": "g_f64", "cardinality": "many", "type": {"kind": "f64"}},
    {"id": "h_u8n", "cardinality": "many", "type": {"kind": "u8n", "min": 0, "max": 255}},
    {"id": "i_u16n", "cardinality": "many", "type": {"kind": "u16n", "min": -32768, "max": 32767}}
  ],
  "components": []
}
