{
  "schema": "fastdb.payload.v1",
  "profile": "record.v1",
  "entries": [
    {
      "id": "items",
      "cardinality": "many",
      "type": {
        "kind": "list",
        "items": {"kind": "component", "id": "Thing"}
      }
    }
  ],
  "components": [
    {
      "id": "Thing",
      "kind": "record",
      "fields": [
        {
          "id": "names",
          "type": {"kind": "list", "items": {"kind": "str"}}
        }
      ]
    }
  ]
}
