{"schema":"fastdb.payload.v1","profile":"record.v1","entries":[{"id":"texts","cardinality":"many","type":{"kind":"str","nullable":true}},{"id":"wide","cardinality":"many","type":{"kind":"wstr","nullable":true}},{"id":"blobs","cardinality":"many","type":{"kind":"bytes","nullable":true}},{"id":"nested","cardinality":"many","type":{"kind":"component","id":"Outer"}}],"components":[{"id":"Inner","kind":"record","fields":[{"id":"label","type":{"kind":"str"}},{"id":"wide","type":{"kind":"wstr"}},{"id":"blob","type":{"kind":"bytes"}}]},{"id":"Outer","kind":"record","fields":[{"id":"prefix","type":{"kind":"str"}},{"id":"inner","type":{"kind":"component","id":"Inner"}},{"id":"suffix","type":{"kind":"bytes"}}]}]}
